"usda_symbol","scientific_name","common_name","family","genus","usda_group"
"POUN7","Potamogeton ×undulatus Wolfgang ex Schult. & Schult. f. (pro sp.) [excluded] (pro sp.)",,,"Potamogeton","Monocot"
"POVI","Polemonium viscosum Nutt.","sticky polemonium",,"Polemonium","Dicot"
"POVI2","Polygonum virginianum L.","jumpseed",,"Polygonum","Dicot"
"POVI3","Polygonum viviparum L.","alpine bistort",,"Polygonum","Dicot"
"POVI7","Polypodium virginianum L.","rock polypody",,"Polypodium","Fern"
"POWA4","Porella wataugensis (Sull.) Underw.","Watauga porella",,"Porella","Liverwort"
"POWI","Polyctenium williamsiae Rollins","Washoe combleaf",,"Polyctenium","Dicot"
"POWI4","Pottia wilsonii (Hook.) Bruch & Schimp.","Wilson's pottia moss",,"Pottia","Moss"
"PRAL7","Prunus alabamensis C. Mohr","Alabama cherry",,"Prunus","Dicot"
"PRANA","Prunus angustifolia Marshall var. angustifolia ","Chickasaw plum",,"Prunus","Dicot"
"PRAY","Pritchardia aylmer-robinsonii H. St. John","Nihoa pritchardia",,"Pritchardia","Monocot"
"PRBO","Primula borealis Duby","northern primrose",,"Primula","Dicot"
"PRCA10","Prosopis calingastana Burkart","cusqui",,"Prosopis","Dicot"
"PRCA3","Primula capillaris N.H. Holmgren & A.H. Holmgren","Ruby Mountain primrose",,"Primula","Dicot"
"PRCA5","Prenanthes carrii Singhurst, O'Kennon & W.C. Holmes","Carr's rattlesnakeroot",,"Prenanthes","Dicot"
"PRCOT","Prosthechea cochleata (L.) W.E. Higgins var. triandra (Ames) W.E. Higgins","clamshell orchid",,"Prosthechea","Monocot"
"PREG","Primula egaliksensis Wormsk. ex Hornem.","Greenland primrose",,"Primula","Dicot"
"PREME","Prunus emarginata (Douglas ex Hook.) D. Dietr. var. emarginata ","bitter cherry",,"Prunus","Dicot"
"PRESC","Prescotia Lindl.","Prescott orchid",,"Prescotia","Monocot"
"PREX2","Primula eximia Greene","arctic primrose",,"Primula","Dicot"
"PRFAF","Prunus fasciculata (Torr.) A. Gray var. fasciculata ","desert almond",,"Prunus","Dicot"
"PRGLT","Prosopis glandulosa Torr. var. torreyana (L.D. Benson) M.C. Johnst.","western honey mesquite",,"Prosopis","Dicot"
"PRHA4","Prosopis hassleri Harms ex Hassler",,,"Prosopis","Dicot"
"PRILL","Prunus ilicifolia (Nutt. ex Hook. & Arn.) D. Dietr. ssp. lyonii (Eastw.) P.H. Raven","hollyleaf cherry",,"Prunus","Dicot"
"PRIN","Primula incana M.E. Jones","silvery primrose",,"Primula","Dicot"
"PRLA4","Pritchardia lanigera Becc.","lo'ulu",,"Pritchardia","Monocot"
"PRLA6","Prosopis laevigata (Humb. & Bonpl. ex Willd.) M.C. Johnst.","smooth mesquite",,"Prosopis","Dicot"
"PROTO3","Protoparmelia M. Choisy","protoparmelia lichen",,"Protoparmelia","Lichen"
"PRPA3","Proserpinaca palustris L.","marsh mermaidweed",,"Proserpinaca","Dicot"
"PRPAP","Proserpinaca palustris L. var. palustris ","marsh mermaidweed",,"Proserpinaca","Dicot"
"PRPU","Prosopis pubescens Benth.","screwbean mesquite",,"Prosopis","Dicot"
"PRPUB","Prunus pumila L. var. besseyi (L.H. Bailey) Gleason","western sandcherry",,"Prunus","Dicot"
"PRPUP","Prunus pumila L. var. pumila ","Great Lakes sandcherry",,"Prunus","Dicot"
"PRRAM2","Prenanthes racemosa Michx. var. multiflora (Cronquist) Dorn","purple rattlesnakeroot",,"Prenanthes","Dicot"
"PRRU4","Prosopis ruizlealii Burkart",,,"Prosopis","Dicot"
"PRSA3","Prunus salicina Lindl.","Japanese plum",,"Prunus","Dicot"
"PRSEC","Prunus serotina Ehrh. ssp. capuli (Cav.) McVaugh","capulí",,"Prunus","Dicot"
"PRTR","Prenanthes trifoliolata (Cass.) Fernald","gall of the earth",,"Prenanthes","Dicot"
"PRVA","Proustia vanillosma C. Wright","sweet yellowcrown",,"Proustia","Dicot"
"PRVE","Prosopis velutina Wooton","velvet mesquite",,"Prosopis","Dicot"
"PRVIM","Prunus virginiana L. var. melanocarpa (A. Nelson) Sarg.","black chokecherry",,"Prunus","Dicot"
"PRVIV","Prunus virginiana L. var. virginiana ","chokecherry",,"Prunus","Dicot"
"PRVUV","Prunella vulgaris L. ssp. vulgaris ","common selfheal",,"Prunella","Dicot"
"PSARA","Psorothamnus arborescens (Torr. ex A. Gray) Barneby var. arborescens ","Mojave indigobush",,"Psorothamnus","Dicot"
"PSAU","Pseudocyphellaria aurata (Ach.) Vain.","Pseudocyphellaria lichen",,"Pseudocyphellaria","Lichen"
"PSBI3","Pseudognaphalium biolettii Anderb.","two-color rabbit-tobacco",,"Pseudognaphalium","Dicot"
"PSBR11","Pseudognaphalium brachypterum (DC.) Anderb. [excluded]",,,"Pseudognaphalium","Dicot"
"PSCA16","Pseuderanthemum carruthersii (Seem.) Guillaumin","Carruthers' falseface",,"Pseuderanthemum","Dicot"
"PSCAT","Pseudognaphalium canescens (DC.) W.A. Weber ssp. thermale (E.E. Nelson) Kartesz","Wright's cudweed",,"Pseudognaphalium","Dicot"
"PSCR60","Pseudocyphellaria crocata (L.) Vain.","Pseudocyphellaria lichen",,"Pseudocyphellaria","Lichen"
"PSDI2","Pseudotaxiphyllum distichaceum (Mitt.) Z. Iwats.","pseudotaxiphyllum moss",,"Pseudotaxiphyllum","Moss"
"PSEUD20","Pseudostellaria Pax","pseudostellaria",,"Pseudostellaria","Dicot"
"PSEUD28","Pseudobryum (Kindb.) T. Kop.","pseudobryum moss",,"Pseudobryum","Moss"
"PSEUD50","Pseudolysimachion (W.D.J. Koch) Opiz","speedwell",,"Pseudolysimachion","Dicot"
"PSEUD51","Pseudobombax Dugand",,,"Pseudobombax","Dicot"
"PSGR2","Psychotria grandis Sw.","cachimbo grande",,"Psychotria","Dicot"
"PSGU","Psidium guajava L.","guava",,"Psidium","Dicot"
"PSGU2","Psychotria guadalupensis (DC.) Howard","Guadalupe wild coffee",,"Psychotria","Dicot"
"PSGUG","Psychotria guadalupensis (DC.) Howard ssp. grosourdyana (Baill.) Steyerm.","Guadalupe wild coffee",,"Psychotria","Dicot"
"PSHA2","Psychotria hathewayi Fosberg","Waianae Range wild coffee",,"Psychotria","Dicot"
"PSHAB","Psychotria hathewayi Fosberg var. brevipetiolata ","Waianae Range wild coffee",,"Psychotria","Dicot"
"PSHEH7","Pseudognaphalium helleri (Britton) Anderb. ssp. helleri ","Heller's cudweed",,"Pseudognaphalium","Dicot"
"PSILO6","Psilopilum Brid.","psilopilum moss",,"Psilopilum","Moss"
"PSIN5","Pseudevernia intensa (Nyl.) Hale & W.L. Culb.","intense light and dark lichen",,"Pseudevernia","Lichen"
"PSING","Pseudoleskea incurvata (Hedw.) Loeske var. gigantea (E. Lawton) H.A. Crum, Steere & L.E. Anderson","giant pseudoleskea moss",,"Pseudoleskea","Moss"
"PSINI","Pseudoleskea incurvata (Hedw.) Loeske var. incurvata ","pseudoleskea moss",,"Pseudoleskea","Moss"
"PSJA2","Pseudostellaria jamesiana (Torr.) W.A. Weber & R.L. Hartm.","tuber starwort",,"Pseudostellaria","Dicot"
"PSLA3","Psoralidium lanceolatum (Pursh) Rydb.","lemon scurfpea",,"Psoralidium","Dicot"
"PSLI2","Psychotria ligustrifolia (Northrop) Millsp.","Bahama wild coffee",,"Psychotria","Dicot"
"PSLOL","Psidium longipes (Berg) McVaugh var. longipes ","mangroveberry",,"Psidium","Dicot"
"PSLU2","Pseudofumaria lutea (L.) Borkh.","rock fumewort",,"Pseudofumaria","Dicot"
"PSNE","Psychotria nervosa Sw.","Seminole balsamo",,"Psychotria","Dicot"
"PSOBS","Pseudognaphalium obtusifolium (L.) Hilliard & B.L. Burtt ssp. saxicola (Fassett) Kartesz","rabbit-tobacco",,"Pseudognaphalium","Dicot"
"PSOD","Psydrax odorata (G. Forst.) A.C. Sm. & S. Darwin","alahe'e",,"Psydrax","Dicot"
"PSPOP","Psorothamnus polydenius (Torr. ex S. Watson) Rydb. var. polydenius ","Nevada dalea",,"Psorothamnus","Dicot"
"PSPR2","Pseudognaphalium pringlei (A. Gray) Anderb.","Pringle's cudweed",,"Pseudognaphalium","Dicot"
"PSRU4","Psorula rufonigra (Tuck.) Gotth. Schneid.","psorula lichen",,"Psorula","Lichen"
"PSSAH2","Pseudognaphalium sandwicensium (Gaudich.) Anderb. var. hawaiiense (O. Deg. & Sherff) W.L. Wagner","'ena'ena",,"Pseudognaphalium","Dicot"
"PSSC6","Psorothamnus scoparius (A. Gray) Rydb.","broom dalea",,"Psorothamnus","Dicot"
"PSSP7","Pseudelephantopus spirilis (Less.) Cronquist","spiral dog's-tongue",,"Pseudelephantopus","Dicot"
"PSSPS","Pseudoroegneria spicata (Pursh) Á. Löve ssp. spicata ","bluebunch wheatgrass",,"Pseudoroegneria","Monocot"
"PSST9","Pseudoroegneria stipifolia (Czern. ex Nevski) Á. Löve",,,"Pseudoroegneria","Monocot"
"PSTE11","Pseudoleskeella tectorum (Funck ex Brid.) Kindb.","pseudoleskeella moss",,"Pseudoleskeella","Moss"
"PTAR","Pteris arborea L.","tree brake",,"Pteris","Fern"
"PTBI","Pteris biaurita L.","thinleaf brake",,"Pteris","Fern"
"PTERO3","Pterospora Nutt.","pinedrops",,"Pterospora","Dicot"
"PTERO4","Pterostegia Fisch. & C.A. Mey.","pterostegia",,"Pterostegia","Dicot"
"PTEX","Pteris excelsa Gaudich.","waimakanui",,"Pteris","Fern"
"PTLA2","Pterygoneurum lamellatum (Lindb.) Jur.","lamella pterygoneurum moss",,"Pterygoneurum","Moss"
"PTNO","Ptilimnium nodosum (Rose) Mathias","piedmont mock bishopweed",,"Ptilimnium","Dicot"
"PTPU2","Ptilidium pulcherrimum (Weber) Vain.",,,"Ptilidium","Liverwort"
"PUAN2","Puccinellia angustata (R. Br.) Rand & Redf.","narrow alkaligrass",,"Puccinellia","Monocot"
"PUDIB","Puccinellia distans (Jacq.) Parl. ssp. borealis (Holmb.) W.E. Hughes","weeping alkaligrass",,"Puccinellia","Monocot"
"PUIN","Puccinellia interior T.J. Sørensen","interior alkaligrass",,"Puccinellia","Monocot"
"PUKA","Puccinellia kamtschatica Holmb.","Alaska alkaligrass",,"Puccinellia","Monocot"
"PUME","Purshia mexicana (D. Don) Henrickson","Mexican cliffrose",,"Purshia","Dicot"
"PUMO","Pueraria montana (Lour.) Merr.","kudzu",,"Pueraria","Dicot"
"PUPAM","Pulsatilla patens (L.) Mill. ssp. multifida (Pritz.) Zamels","cutleaf anemone",,"Pulsatilla","Dicot"
"PURU","Puccinellia rupestris (With.) Fernald & Weath.","British alkaligrass",,"Puccinellia","Monocot"
"PUTET","Puccinellia tenella (Lange) Holmb. ex A.E. Porsild ssp. tenella ","tundra alkaligrass",,"Puccinellia","Monocot"
"PYCE","Pyrenula cerina Eschw.","wart lichen",,"Pyrenula","Lichen"
"PYCI","Pyrenula citriformis R.C. Harris","wart lichen",,"Pyrenula","Lichen"
"PYCO10","Pyrenula concatervans (Nyl.) R.C. Harris","wart lichen",,"Pyrenula","Lichen"
"PYCRG","Pyrrocoma crocea (A. Gray) Greene var. genuflexa (Greene) Mayes ex G. Brown & Keil","curlyhead goldenweed",,"Pyrrocoma","Dicot"
"PYCU","Pycnanthemum curvipes (Greene) E. Grant & Epling","stone mountainmint",,"Pycnanthemum","Dicot"
"PYFL2","Pycnanthemum floridanum E. Grant & Epling","Florida mountainmint",,"Pycnanthemum","Dicot"
"PYFU2","Pyrenopsis furfurea (Nyl.) Th. Fr.","pyrenopsis lichen",,"Pyrenopsis","Lichen"
"PYGR","Pyrola grandiflora Radius","largeflowered wintergreen",,"Pyrola","Dicot"
"PYHIH","Pyrrocoma hirta (A. Gray) Greene var. hirta ","tacky goldenweed",,"Pyrrocoma","Dicot"
"PYHIL","Pyrrocoma hirta (A. Gray) Greene var. lanulosa (Greene) Mayes ex G. Brown & Keil","tacky goldenweed",,"Pyrrocoma","Dicot"
"PYHIS","Pyrrocoma hirta (A. Gray) Greene var. sonchifolia (Greene) Kartesz & Gandhi","tacky goldenweed",,"Pyrrocoma","Dicot"
"PYLAL","Pyrrocoma lanceolata (Hook.) Greene var. lanceolata ","lanceleaf goldenweed",,"Pyrrocoma","Dicot"
"PYMA9","Pyrenula mamillana (Ach.) Trevis.",,,"Pyrenula","Lichen"
"PYMI6","Pyrenula microcarpa Müll. Arg.","wart lichen",,"Pyrenula","Lichen"
"PYPO3","Pylaisiella polyantha (Hedw.) Grout","pylaisiella moss",,"Pylaisiella","Moss"
"PYPYV","Pycnanthemum pycnanthemoides (Leavenworth) Fernald var. viridifolium Fernald","southern mountainmint",,"Pycnanthemum","Dicot"
"PYQU2","Pyrrhospora quernea (Dicks.) Körb.","pyrrhospora lichen",,"Pyrrhospora","Lichen"
"PYRA","Pyrrocoma racemosa (Nutt.) Torr. & A. Gray","clustered goldenweed",,"Pyrrocoma","Dicot"
"PYRAS","Pyrrocoma racemosa (Nutt.) Torr. & A. Gray var. sessiliflora (Greene) Mayes ex G. Brown & Keil","clustered goldenweed",,"Pyrrocoma","Dicot"
"PYSU3","Pyrenopsis subfulginea Nyl.","pyrenopsis lichen",,"Pyrenopsis","Lichen"
"PYTE","Pycnanthemum tenuifolium Schrad.","narrowleaf mountainmint",,"Pycnanthemum","Dicot"
"PYTE4","Pylaisiadelpha tenuirostris (Bruch & Schimp.) W.R. Buck","pylaisiadelpha moss",,"Pylaisiadelpha","Moss"
"PYTH","Pyrenula thelomorpha Tuck.","wart lichen",,"Pyrenula","Lichen"
"PYVEV","Pycnanthemum verticillatum (Michx.) Pers. var. verticillatum ","whorled mountainmint",,"Pycnanthemum","Dicot"
"QUAJ","Quercus ajoensis C.H. Mull.","Ajo Mountain scrub oak",,"Quercus","Dicot"
"QUAM","Quassia amara L.","quassia wood",,"Quassia","Dicot"
"QUBE","Quercus ×beadlei Trel. ex Palmer [alba × michauxii]","Beadle oak",,"Quercus","Dicot"
"QUCH2","Quercus chrysolepis Liebm.","canyon live oak",,"Quercus","Dicot"
"QUCOT","Quercus coccinea Münchh. var. tuberculata Sarg.","scarlet oak",,"Quercus","Dicot"
"QUDE4","Quercus dentata Thunb.","Daimyo oak",,"Quercus","Dicot"
"QUFI","Quercus ×filialis Little [phellos × velutina]","hybrid oak",,"Quercus","Dicot"
"QUGAG2","Quercus garryana Douglas ex Hook. var. garryana ","Oregon white oak",,"Quercus","Dicot"
"QUIM","Quercus imbricaria Michx.","shingle oak",,"Quercus","Dicot"
"QUIN10","Quisqualis indica L.","Rangoon creeper",,"Quisqualis","Dicot"
"QUIN6","Quercus infectoria Olivier","aleppo oak",,"Quercus","Dicot"
"QULA3","Quercus laurifolia Michx.","laurel oak",,"Quercus","Dicot"
"QULO2","Quincula lobata (Torr.) Raf.","Chinese lantern",,"Quincula","Dicot"
"QUMU","Quercus muehlenbergii Engelm.","chinquapin oak",,"Quercus","Dicot"
"QUPA4","Quercus ×pauciloba Rydb. (pro sp.) [gambelii × turbinella]",,,"Quercus","Dicot"
"QUPA5","Quercus pagoda Raf.","cherrybark oak",,"Quercus","Dicot"
"QUPAP2","Quercus parvula Greene var. parvula ","Santa Cruz Island oak",,"Quercus","Dicot"
"QUPAS2","Quercus parvula Greene var. shrevei (C.H. Mull.) Nixon","Shreve oak",,"Quercus","Dicot"
"QURUR","Quercus rubra L. var. rubra ","northern red oak",,"Quercus","Dicot"
"QUSA","Quercus ×saulii C.K. Schneid. [alba × montana]","hybrid oak",,"Quercus","Dicot"
"RAACF","Ranunculus acris L. var. frigidus Regel","tall buttercup",,"Ranunculus","Dicot"
"RAAL4","Ranunculus allenii B.L. Rob.","Allen's buttercup",,"Ranunculus","Dicot"
"RAALA2","Ranunculus alismifolius Geyer ex Benth. var. alismifolius ","plantainleaf buttercup",,"Ranunculus","Dicot"
"RAAQ","Ranunculus aquatilis L.","white water crowfoot",,"Ranunculus","Dicot"
"RABU","Ranunculus bulbosus L.","St. Anthony's turnip",,"Ranunculus","Dicot"
"RACO3","Ratibida columnifera (Nutt.) Wooton & Standl.","upright prairie coneflower",,"Ratibida","Dicot"
"RACOD","Racodium Pers. ex Fr.","racodium lichen",,"Racodium","Lichen"
"RACY","Ranunculus cymbalaria Pursh","alkali buttercup",,"Ranunculus","Dicot"
"RAEST","Ranunculus eschscholtzii Schltdl. var. trisectus (Eastw.) L.D. Benson","threesection buttercup",,"Ranunculus","Dicot"
"RAFA","Ranunculus fascicularis Muhl. ex Bigelow","early buttercup",,"Ranunculus","Dicot"
"RAFA4","Ramalina fastigiata (Pers.) Ach.","cartilage lichen",,"Ramalina","Lichen"
"RAFI","Ranunculus ficaria L.","fig buttercup",,"Ranunculus","Dicot"
"RAFLF2","Ranunculus flammula L. var. flammula ","greater creeping spearwort",,"Ranunculus","Dicot"
"RAHA2","Ranunculus hawaiensis A. Gray","Hawai'ian buttercup",,"Ranunculus","Dicot"
"RAILL","Raillardella (A. Gray) Benth.","raillardella",,"Raillardella","Dicot"
"RAINI2","Ranunculus inamoenus Greene var. inamoenus ","graceful buttercup",,"Ranunculus","Dicot"
"RAINS","Ranunculus inamoenus Greene var. subaffinis (A. Gray) L.D. Benson","graceful buttercup",,"Ranunculus","Dicot"
"RAKA3","Ranunculus karelinii Czern.","ice cold buttercup",,"Ranunculus","Dicot"
"RALA9","Ranunculus lappaceus Sm.","Australian buttercup",,"Ranunculus","Dicot"
"RALI5","Ramalina linearis (Sw.) Ach.","linear cartilage lichen",,"Ramalina","Lichen"
"RALO2","Ranunculus longirostris Godr.","longbeak buttercup",,"Ranunculus","Dicot"
"RAMI8","Racomitrium microcarpon (Hedw.) Brid.","racomitrium moss",,"Racomitrium","Moss"
"RAORO","Ranunculus orthorhynchus Hook. var. orthorhynchus ","straightbeak buttercup",,"Ranunculus","Dicot"
"RAPU","Ranunculus pusillus Poir.","low spearwort",,"Ranunculus","Dicot"
"RAPUA","Ranunculus pusillus Poir. var. angustifolius (Engelm.) L.D. Benson","low spearwort",,"Ranunculus","Dicot"
"RAPYP2","Ranunculus pygmaeus Wahlenb. var. pygmaeus ","pygmy buttercup",,"Ranunculus","Dicot"
"RARET2","Ranunculus recurvatus Poir. var. tropicus (Griseb.) Fawc. & Rendle","blisterwort",,"Ranunculus","Dicot"
"RARH","Ranunculus rhomboideus Goldie","Labrador buttercup",,"Ranunculus","Dicot"
"RARO60","Ramalina roesleri (Hochst. ex Schaerer) Hue","Roesler's cartilage lichen",,"Ramalina","Lichen"
"RASA2","Raphanus sativus L.","cultivated radish",,"Raphanus","Dicot"
"RAVA2","Ramonia valenzueliana (Mont.) Stizenb.","Valenzuela's ramonia",,"Ramonia","Lichen"
"RAVI2","Raphia vinifera P. Beauv.","West African piassava palm",,"Raphia","Monocot"
"REAB","Relicina abstrusa (Vain.) Hale","relicina lichen",,"Relicina","Lichen"
"REJAP","Renealmia jamaicensis (Gaertn.) Horan. var. puberula (Gagnep.) Maas","narciso colorado",,"Renealmia","Monocot"
"RELIC","Relicina (Hale & Kurok.) Hale","relicina lichen",,"Relicina","Lichen"
"REMA3","Remirea maritima Aubl.","beachstar",,"Remirea","Monocot"
"REYNO2","Reynosia Griseb.","darlingplum",,"Reynosia","Dicot"
"RHAR3","Rhododendron arborescens (Pursh) Torr.","smooth azalea",,"Rhododendron","Dicot"
"RHBA2","Rhipsalis baccifera (Sol. ex J.S. Muell.) Stearn","mistletoe cactus",,"Rhipsalis","Dicot"
"RHBR4","Rhododendron brachycarpum D. Don ex G. Don",,,"Rhododendron","Dicot"
"RHCA21","Rhynchosia calosperma Warb.",,,"Rhynchosia","Dicot"
"RHCA4","Rhododendron calendulaceum (Michx.) Torr.","flame azalea",,"Rhododendron","Dicot"
"RHCA7","Rhododendron canescens (Michx.) Sweet","mountain azalea",,"Rhododendron","Dicot"
"RHCO7","Rhynchospora colorata (L.) H. Pfeiffer","starrush whitetop",,"Rhynchospora","Monocot"
"RHCOL2","Rhus copallinum L. var. latifolia Engl.","winged sumac",,"Rhus","Dicot"
"RHED","Rhynchosia edulis Griseb.","Chihuahuan snoutbean",,"Rhynchosia","Dicot"
"RHEXI","Rhexia L.","meadowbeauty",,"Rhexia","Dicot"
"RHFL","Rhododendron flammeum (Michx.) Sarg.","piedmont azalea",,"Rhododendron","Dicot"
"RHGE60","Rhizocarpon geographicum (L.) DC.","world map lichen",,"Rhizocarpon","Lichen"
"RHGL2","Rhynchospora globularis (Chapm.) Small","globe beaksedge",,"Rhynchospora","Monocot"
"RHINI","Rhodiola integrifolia Raf. ssp. integrifolia ","ledge stonecrop",,"Rhodiola","Dicot"
"RHJA5","Rhytidiadelphus japonicus Reim.","Japanese goose neck moss",,"Rhytidiadelphus","Moss"
"RHLA3","Rhus lanceolata (A. Gray) Britton","prairie sumac",,"Rhus","Dicot"
"RHLAL","Rhododendron lapponicum (L.) Wahlenb. var. lapponicum ","Lapland rosebay",,"Rhododendron","Dicot"
"RHLE","Rhynchosia lewtonii (Vail) K. Schum.","pinelands snoutbean",,"Rhynchosia","Dicot"
"RHMI11","Rhus michauxii Sarg.","false poison sumac",,"Rhus","Dicot"
"RHMI3","Rhus microphylla Engelm. ex A. Gray","littleleaf sumac",,"Rhus","Dicot"
"RHMI4","Rhynchosia minima (L.) DC.","least snoutbean",,"Rhynchosia","Dicot"
"RHMI7","Rhynchospora microcarpa Baldw. ex A. Gray","southern beaksedge",,"Rhynchospora","Monocot"
"RHMIG","Rhinanthus minor L. ssp. groenlandicus (Ostenf.) L. Neum.","arctic rattlebox",,"Rhinanthus","Dicot"
"RHOC","Rhododendron occidentale (Torr. & A. Gray) A. Gray","western azalea",,"Rhododendron","Dicot"
"RHOCO","Rhododendron occidentale (Torr. & A. Gray) A. Gray var. occidentale ","western azalea",,"Rhododendron","Dicot"
"RHODO","Rhododendron L.","rhododendron",,"Rhododendron","Dicot"
"RHOV","Rhus ovata S. Watson","sugar sumac",,"Rhus","Dicot"
"RHPA","Rhynchospora pallida M.A. Curtis","pale beaksedge",,"Rhynchospora","Monocot"
"RHPA6","Rhizocarpon parvum Runem.","map lichen",,"Rhizocarpon","Lichen"
"RHPE8","Rhizocarpon petraeum (Wulfen) A. Massal.",,,"Rhizocarpon","Lichen"
"RHPI","Rhamnus pirifolia Greene","island redberry",,"Rhamnus","Dicot"
"RHPO6","Rhizocarpon postumum (Nyl.) Arnold",,,"Rhizocarpon","Lichen"
"RHPS70","Rhizomnium pseudopunctatum (Bruch & Schimp.) T. Kop.","rhizomnium moss",,"Rhizomnium","Moss"
"RHRE3","Rhynchosia reticulata (Sw.) DC.","habilla",,"Rhynchosia","Dicot"
"RHRE5","Rhizocarpon renneri Poelt","Renner's map lichen",,"Rhizocarpon","Lichen"
"RHSE3","Rhamnus serrata Humb. & Bonpl. ex Schult.","sawleaf buckthorn",,"Rhamnus","Dicot"
"RHST8","Rhizophora stylosa Griff.","small stilted mangrove",,"Rhizophora","Dicot"
"RHTY","Rhus typhina L.","staghorn sumac",,"Rhus","Dicot"
"RHUN","Rhynchospora uniflora Boeckeler","oneflower beaksedge",,"Rhynchospora","Monocot"
"RHUS","Rhus L.","sumac",,"Rhus","Dicot"
"RHUS2","Rhynchosia usambarensis Taub.",,,"Rhynchosia","Dicot"
"RHVA5","Rhododendron ×vanhoeffeni Abromeit [tomentosum ssp. subarcticum × lapponicum]","hybrid rhododendron",,"Rhododendron","Dicot"
"RHVE5","Rhizocarpon vernicomoideum Fink","map lichen",,"Rhizocarpon","Lichen"
"RHVI2","Rhododendron viscosum (L.) Torr.","swamp azalea",,"Rhododendron","Dicot"
"RHVI3","Rhus virens Lindh. ex A. Gray","evergreen sumac",,"Rhus","Dicot"
"RIAF","Riella affinis M. Howe & Underw.",,,"Riella","Liverwort"
"RIAM","Ribes amarum McClatchie","bitter gooseberry",,"Ribes","Dicot"
"RIBR2","Richardia brasiliensis Gomes","tropical Mexican clover",,"Richardia","Dicot"
"RICA10","Rimularia caeca (Lowe) Rambold & Printzen",,,"Rimularia","Lichen"
"RICA6","Rinodina calcigena (Th. Fr.) Lynge","rinodina lichen",,"Rinodina","Lichen"
"RICAC","Ribes californicum Hook. & Arn. var. californicum ","hillside gooseberry",,"Ribes","Dicot"
"RICO6","Rimelia commensurata (Hale) Hale & Fletcher","rimelia lichen",,"Rimelia","Lichen"
"RICRC","Ribes cruentum Greene var. cruentum ","shinyleaf currant",,"Ribes","Dicot"
"RICY","Ribes cynosbati L.","eastern prickly gooseberry",,"Ribes","Dicot"
"RIGL","Ribes glandulosum Grauer","skunk currant",,"Ribes","Dicot"
"RIGR8","Rinodina griseosoralifera Coppins",,,"Rinodina","Lichen"
"RIHI","Ribes hirtellum Michx.","hairystem gooseberry",,"Ribes","Dicot"
"RIHUP","Ribes hudsonianum Richardson var. petiolare (Douglas) Jancz.","western black currant",,"Ribes","Dicot"
"RIIN","Ribes indecorum Eastw.","whiteflower currant",,"Ribes","Dicot"
"RIIN8","Riccardia incurvata Lindb.",,,"Riccardia","Liverwort"
"RIJU","Riccardia jugata R.M. Schust.",,,"Riccardia","Liverwort"
"RILA4","Rinodina laevigata (Ach.) Malme","rinodina lichen",,"Rinodina","Lichen"
"RIMAV","Ribes malvaceum Sm. var. viridifolium Abrams","chaparral currant",,"Ribes","Dicot"
"RIMEI","Ribes menziesii Pursh var. ixoderme Quick","canyon gooseberry",,"Ribes","Dicot"
"RIMEL","Ribes menziesii Pursh var. leptosmum (Coville) Jeps.","canyon gooseberry",,"Ribes","Dicot"
"RIMUL","Rimularia Nyl.","rimularia lichen",,"Rimularia","Lichen"
"RIOXI","Ribes oxyacanthoides L. ssp. irriguum (Douglas) Sinnott","Idaho gooseberry",,"Ribes","Dicot"
"RIPA6","Riccardia palmata (Hedw.) Carruth.",,,"Riccardia","Liverwort"
"RIPI","Ribes pinetorum Greene","orange gooseberry",,"Ribes","Dicot"
"RIPO","Rinodina polyspora Th. Fr.","manyspore rinodina lichen",,"Rinodina","Lichen"
"RISE","Ribes sericeum Eastw.","Lucia gooseberry",,"Ribes","Dicot"
"RISI","Rimelia simulans (Hale) Hale & Fletcher","rimelia lichen",,"Rimelia","Lichen"
"RISP2","Rimularia sphacelata (Th. Fr.) Hertel & Rambold","rimularia lichen",,"Rimularia","Lichen"
"RISU8","Rimeliella subsumpta (Nyl.) Kurok.",,,"Rimeliella","Lichen"
"RITH4","Rinodina thomsonii Sheard",,,"Rinodina","Lichen"
"RIVI2","Ribes victoris Greene","Victor's gooseberry",,"Ribes","Dicot"
"RIWO","Ribes wolfii Rothr.","Wolf's currant",,"Ribes","Dicot"
"ROACS","Rosa acicularis Lindl. ssp. sayi (Schwein.) W.H. Lewis","prickly rose",,"Rosa","Dicot"
"ROAL","Rorippa alpina (S. Watson) Rydb.","alpine yellowcress",,"Rorippa","Dicot"
"ROAM2","Robinia ×ambigua Poir. (pro sp.) [pseudoacacia × viscosa]","hybrid locust",,"Robinia","Dicot"
"ROARS","Rosa arkansana Porter var. suffulta (Greene) Cockerell","prairie rose",,"Rosa","Dicot"
"ROCA6","Romanzoffia californica Greene","California mistmaiden",,"Romanzoffia","Dicot"
"ROCA8","Rorippa cantoniensis (Lour.) Ohwi","Chinese yellowcress",,"Rorippa","Dicot"
"ROCAC","Rosa carolina L. var. carolina ","Carolina rose",,"Rosa","Dicot"
"ROCUL","Rorippa curvisiliqua (Hook.) Besser ex Britton var. lyrata (Nutt.) M. Peck ex C.L. Hitchc.","lyrateleaf yellowcress",,"Rorippa","Dicot"
"ROGI2","Rosa giraldii Crép.",,,"Rosa","Dicot"
"ROHA3","Roldana hartwegii (Benth.) H. Rob. & Brettel","Hartweg's groundsel",,"Roldana","Dicot"
"ROHIK","Robinia hispida L. var. kelseyi (J.F. Cowell ex Hutch.) Isely","Kelsey's locust",,"Robinia","Dicot"
"ROHIR","Robinia hispida L. var. rosea Pursh","bristly locust",,"Robinia","Dicot"
"ROINI","Rorippa indica (L.) Hiern. var. indica ","variableleaf yellowcress",,"Rorippa","Dicot"
"ROLDA","Roldana Llave ex Lex.","groundsel",,"Roldana","Dicot"
"ROLLI","Rollinia A. St.-Hil.","rollinia",,"Rollinia","Dicot"
"ROMAN","Romanzoffia Cham.","mistmaiden",,"Romanzoffia","Dicot"
"ROOD2","Rosa ×odorata (Andrews) Sweet (pro sp.) [chinensis × gigantea]","tea rose",,"Rosa","Dicot"
"ROPA4","Rosa ×palustriformis Rydb. (pro sp.) [blanda × palustris]","hybrid rose",,"Rosa","Dicot"
"ROPAO","Rorippa palustris (L.) Besser ssp. occidentalis (S. Watson) Abrams","western bog yellowcress",,"Rorippa","Dicot"
"ROPI2","Rosa pisocarpa A. Gray","cluster rose",,"Rosa","Dicot"
"ROPS","Robinia pseudoacacia L.","black locust",,"Robinia","Dicot"
"RORO5","Roellia roellii (Broth.) Andrews ex H.A. Crum","Roell's moss",,"Roellia","Moss"
"ROROH","Rosa roxburghii Tratt. var. hirtula (Regel) Rehder & E.H. Wilson",,,"Rosa","Dicot"
"ROSEO2","Rosa sericea Lindl. ssp. omeiensis (Rolfe) A.V. Roberts",,,"Rosa","Dicot"
"ROSI5","Rosa sicula Tratt.","Mediterranean rose",,"Rosa","Dicot"
"ROSP3","Rosa spithamea S. Watson","ground rose",,"Rosa","Dicot"
"ROTTB","Rottboellia L. f.","itchgrass",,"Rottboellia","Monocot"
"ROUNU","Romanzoffia unalaschcensis Cham. var. unalaschcensis ","Alaska mistmaiden",,"Romanzoffia","Dicot"
"ROWA5","Rosa ×waitziana Tratt.",,,"Rosa","Dicot"
"ROWOG","Rosa woodsii Lindl. var. glabrata (Parish) Cole","Woods' rose",,"Rosa","Dicot"
"ROWOU","Rosa woodsii Lindl. var. ultramontana (S. Watson) Jeps.","Woods' rose",,"Rosa","Dicot"
"ROWOW","Rosa woodsii Lindl. var. woodsii ","Woods' rose",,"Rosa","Dicot"
"RUAB","Rubus aboriginum Rydb.","garden dewberry",,"Rubus","Dicot"
"RUAL10","Rumex ×alexidis B. Boivin [maritimus × stenophyllus]","Alex's dock",,"Rumex","Dicot"
"RUAL4","Rumex altissimus Alph. Wood","pale dock",,"Rumex","Dicot"
"RUAL9","Rubus alumnus L.H. Bailey","oldfield blackberry",,"Rubus","Dicot"
