"usda_symbol","scientific_name","common_name","family","genus","usda_group"
"HYNE","Hymenopappus newberryi (A. Gray) I.M. Johnst.","Newberry's hymenopappus",,"Hymenopappus","Dicot"
"HYPAP","Hypnum pallescens (Hedw.) P. Beauv. var. pallescens ","hypnum moss",,"Hypnum","Moss"
"HYPEL","Hypelate P. Br.","hypelate",,"Hypelate","Dicot"
"HYPER2","Hyperbaena Miers ex Benth.","hyperbaena",,"Hyperbaena","Dicot"
"HYPU10","Hymenocallis puntagordensis Traub","Punta Gorda spiderlily",,"Hymenocallis","Monocot"
"HYRE71","Hymenostylium recurvirostre (Hedw.) Dix.","hymenostylium moss",,"Hymenostylium","Moss"
"HYRIF","Hymenoxys richardsonii (Hook.) Cockerell var. floribunda (A. Gray) K.F. Parker","Colorado rubberweed",,"Hymenoxys","Dicot"
"HYRU3","Hypogymnia rugosa (G. Merr.) L. Pike","tube lichen",,"Hypogymnia","Lichen"
"HYSAP","Hymenoclea salsola Torr. & A. Gray var. pentalepis (Rydb.) L.D. Benson","burrobrush",,"Hymenoclea","Dicot"
"HYSI2","Hymenophyllum sieberi (C. Presl) Bosch","Sieber's filmy fern",,"Hymenophyllum","Fern"
"HYSP70","Hylocomium splendens (Hedw.) Schimp.","splendid feather moss",,"Hylocomium","Moss"
"HYSU2","Hypericum suffruticosum P. Adams & N. Robson","pineland St. Johnswort",,"Hypericum","Dicot"
"HYTE10","Hylotelephium telephium (L.) H. Ohba","witch's moneybags",,"Hylotelephium","Dicot"
"HYTE3","Hypolepis tenerrima Maxon","royal beadfern",,"Hypolepis","Fern"
"HYTES","Hygroamblystegium tenax (Hedw.) Jenn. var. spinifolium (Schimp.) Jenn.","hygroamblystegium moss",,"Hygroamblystegium","Moss"
"HYTR","Hypelate trifoliata Sw.","inkwood",,"Hypelate","Dicot"
"HYTR4","Hymenocallis tridentata Small","Florida spiderlily",,"Hymenocallis","Monocot"
"HYTU60","Hypogymnia tubulosa (Schaerer) Hav.","tube lichen",,"Hypogymnia","Lichen"
"HYUM2","Hylocomiastrum umbratum (Hedw.) Fleisch.","hylocomiastrum moss",,"Hylocomiastrum","Moss"
"HYUN2","Hymenophyllum undulatum (Sw.) Sw.","wavy filmy fern",,"Hymenophyllum","Fern"
"HYVI3","Hypogynium virgatum (Desv. ex Ham.) Dandy","West Indian bluestem",,"Hypogynium","Monocot"
"HYVI6","Hypericum virgatum Lam.","sharpleaf St. Johnswort",,"Hypericum","Dicot"
"HYVI60","Hypogymnia vittata (Ach.) Parrique","Vitt tube lichen",,"Hypogymnia","Lichen"
"ILCO2","Ilex collina Alexander","longstalk holly",,"Ilex","Dicot"
"ILCO3","Ilex cookii Britton & P. Wilson","te",,"Ilex","Dicot"
"ILCR2","Ilex crenata Thunb.","Japanese holly",,"Ilex","Dicot"
"ILDE","Ilex decidua Walter","possumhaw",,"Ilex","Dicot"
"ILLA","Ilex laevigata (Pursh) A. Gray","smooth winterberry",,"Ilex","Dicot"
"ILLEC","Illecebrum L.","coral necklace",,"Illecebrum","Dicot"
"ILRID","Iliamna rivularis (Douglas ex Hook.) Greene var. diversa (A. Nelson) Wiggins","streambank wild hollyhock",,"Iliamna","Dicot"
"ILUR","Ilex urbaniana Loes.","Urban's holly",,"Ilex","Dicot"
"ILVE","Ilex verticillata (L.) A. Gray","common winterberry",,"Ilex","Dicot"
"IMBA","Impatiens balsamina L.","spotted snapweed",,"Impatiens","Dicot"
"IMPAT","Impatiens L.","touch-me-not",,"Impatiens","Dicot"
"INMI","Indigofera miniata Ortega","coastal indigo",,"Indigofera","Dicot"
"INOX","Indigofera oxycarpa Desv.","Asian indigo",,"Indigofera","Dicot"
"INZO","Indigofera zollingeriana Miq.","Zollinger's indigo",,"Indigofera","Dicot"
"IPAGA3","Ipomopsis aggregata (Pursh) V.E. Grant ssp. aggregata ","scarlet gilia",,"Ipomopsis","Dicot"
"IPAGF","Ipomopsis aggregata (Pursh) V.E. Grant ssp. formosissima (Greene) Wherry","scarlet gilia",,"Ipomopsis","Dicot"
"IPAR2","Ipomopsis arizonica (Greene) Wherry","Arizona ipomopsis",,"Ipomopsis","Dicot"
"IPBA2","Ipomoea batatas (L.) Lam.","sweetpotato",,"Ipomoea","Dicot"
"IPCA5","Ipomoea carnea Jacq.","gloria de la manana",,"Ipomoea","Dicot"
"IPCOC3","Ipomopsis congesta (Hook.) V.E. Grant ssp. congesta ","ballhead ipomopsis",,"Ipomopsis","Dicot"
"IPCOF","Ipomopsis congesta (Hook.) V.E. Grant ssp. frutescens (Rydb.) Day","ballhead ipomopsis",,"Ipomopsis","Dicot"
"IPCON","Ipomopsis congesta (Hook.) V.E. Grant ssp. nevadensis (Tidestr.) Kartesz & Gandhi","ballhead ipomopsis",,"Ipomopsis","Dicot"
"IPCOT","Ipomoea cordatotriloba Dennst. var. torreyana (A. Gray) D. Austin","Torrey's tievine",,"Ipomoea","Dicot"
"IPLA2","Ipomopsis laxiflora (J.M. Coult.) V.E. Grant","iron ipomopsis",,"Ipomopsis","Dicot"
"IPLOA","Ipomopsis longiflora (Torr.) V.E. Grant ssp. australis Fletcher & W.L. Wagner","whiteflower ipomopsis",,"Ipomopsis","Dicot"
"IPME","Ipomoea meyeri (Spreng.) G. Don","Meyer's morning-glory",,"Ipomoea","Dicot"
"IPMI","Ipomoea microdactyla Griseb.","calcareous morning-glory",,"Ipomoea","Dicot"
"IPNI","Ipomoea nil (L.) Roth","whiteedge morning-glory",,"Ipomoea","Dicot"
"IPOB","Ipomoea obscura (L.) Ker Gawl.","obscure morning-glory",,"Ipomoea","Dicot"
"IPPEP2","Ipomoea pes-caprae (L.) R. Br. ssp. pes-caprae (L.) R. Br. [excluded]","bayhops",,"Ipomoea","Dicot"
"IPPU3","Ipomoea pubescens Lam.","silky morning-glory",,"Ipomoea","Dicot"
"IPRO","Ipomopsis roseata (Rydb.) V.E. Grant","rosy ipomopsis",,"Ipomopsis","Dicot"
"IPSPS","Ipomopsis spicata (Nutt.) V.E. Grant ssp. spicata ","spiked ipomopsis",,"Ipomopsis","Dicot"
"IPTR3","Ipomoea tricolor Cav.","grannyvine",,"Ipomoea","Dicot"
"IRDO","Iris douglasiana Herb.","Douglas iris",,"Iris","Monocot"
"IRGI","Iris giganticaerulea Small","giant blue iris",,"Iris","Monocot"
"IRHEH","Iris hexagona Walter var. hexagona ","Dixie iris",,"Iris","Monocot"
"IRLA","Iris lacustris Nutt.","dwarf lake iris",,"Iris","Monocot"
"IRPR","Iris prismatica Pursh ex Ker Gawl.","slender blue iris",,"Iris","Monocot"
"IRRH","Iresine rhizomatosa Standl.","Juda's bush",,"Iresine","Dicot"
"IRSPG","Iris spuria L. ssp. guldenstaedtiana (Lepech.) Soldano",,,"Iris","Monocot"
"IRTI","Iris tingitana Boiss. & Reut. [excluded]","Morocco iris",,"Iris","Monocot"
"IRVEV","Iris verna L. var. verna ","dwarf violet iris",,"Iris","Monocot"
"IRVIS","Iris virginica L. var. shrevei (Small) E.S. Anderson","Shreve's iris",,"Iris","Monocot"
"ISACH","Isachne R. Br.","bloodgrass",,"Isachne","Monocot"
"ISAL","Isopterygiopsis alpicola (Lindb. ex Lindb. & Arnell) Hedenäs","isopterygiopsis moss",,"Isopterygiopsis","Moss"
"ISBU2","Isopogon buxifolius R. Br.",,,"Isopogon","Dicot"
"ISFL4","Isolepis fluitans (L.) R. Br.",,,"Isolepis","Monocot"
"ISMEM","Isocoma menziesii (Hook. & Arn.) G.L. Nesom var. menziesii ","Menzies' goldenbush",,"Isocoma","Dicot"
"ISMY2","Isothecium myosuroides Brid.","isothecium moss",,"Isothecium","Moss"
"ISOC","Isoetes occidentalis L.F. Hend.","western quillwort",,"Isoetes","Quillwort"
"ISOP","Isocarpha oppositifolia (L.) Cass.","Rio Grande pearlhead",,"Isocarpha","Dicot"
"ISOPT3","Isopterygium Mitt.","isopterygium moss",,"Isopterygium","Moss"
"ISOTH","Isothecium Brid.","isothecium moss",,"Isothecium","Moss"
"ISPL","Isocoma pluriflora (Torr. & A. Gray) Greene","southern goldenbush",,"Isocoma","Dicot"
"ISRIR","Isoetes riparia Engelm. ex A. Braun var. riparia ","shore quillwort",,"Isoetes","Quillwort"
"ISSA","Isoetes saccharata Engelm.","sugar quillwort",,"Isoetes","Quillwort"
"ISTE3","Isopterygium tenerum (Sw.) Mitt.","isopterygium moss",,"Isopterygium","Moss"
"ISVE5","Isocoma veneta (Kunth) Greene [excluded]",,,"Isocoma","Dicot"
"IVAX","Iva axillaris Pursh","povertyweed",,"Iva","Dicot"
"IVCA","Ivesia callida (H.M. Hall) Rydb.","Tahquitz mousetail",,"Ivesia","Dicot"
"IVLO","Ivesia longibracteata Ertter","longbract mousetail",,"Ivesia","Dicot"
"IVLYS","Ivesia lycopodioides A. Gray ssp. scandularis (Rydb.) D.D. Keck","clubmoss mousetail",,"Ivesia","Dicot"
"IVPY","Ivesia pygmaea A. Gray","dwarf mousetail",,"Ivesia","Dicot"
"IVSHO","Ivesia shockleyi S. Watson var. ostleri Ertter","Ostler's mousetail",,"Ivesia","Dicot"
"JAAMM","Jamesia americana Torr. & A. Gray var. macrocalyx (Small) Engl.","fivepetal cliffbush",,"Jamesia","Dicot"
"JAAMR","Jamesia americana Torr. & A. Gray var. rosea J.A. Purpus ex C.K. Schneid.","fivepetal cliffbush",,"Jamesia","Dicot"
"JACA7","Jacquemontia cayensis Britton","sandyplain clustervine",,"Jacquemontia","Dicot"
"JAEGE","Jaegerina Müll. Hal.","jaegerina moss",,"Jaegerina","Moss"
"JAGOE","Jatropha gossypiifolia L. var. elegans (Pohl) Müll. Arg.","bellyache bush",,"Jatropha","Dicot"
"JAMI","Jacaranda mimosifolia D. Don","black poui",,"Jacaranda","Dicot"
"JARA","Jaffueliobryum raui (Austin) Thér.","jaffueliobryum moss",,"Jaffueliobryum","Moss"
"JASA","Jasminum sambac (L.) Aiton","Arabian jasmine",,"Jasminum","Dicot"
"JASO","Jacquemontia solanifolia (L.) Hallier","cambustera de costa",,"Jacquemontia","Dicot"
"JEHE","Jepsonia heterandra Eastw.","foothill jepsonia",,"Jepsonia","Dicot"
"JERA","Jensia rammii (Greene) B.G. Baldw.","Ramm's madia",,"Jensia","Dicot"
"JUAC3","Juncus acutiflorus Ehrh.","sharpflower rush",,"Juncus","Monocot"
"JUAI2","Juglans ailantifolia Carrière","Japanese walnut",,"Juglans","Dicot"
"JUALN","Juncus alpinoarticulatus Chaix ssp. nodulosus (Wahlenb.) Hämet-Ahti","northern green rush",,"Juncus","Monocot"
"JUARA5","Juncus arcticus Willd. ssp. arcticus ","arctic rush",,"Juncus","Monocot"
"JUBUO","Juncus bufonius L. var. occidentalis F.J. Herm.","toad rush",,"Juncus","Monocot"
"JUCOO","Juncus covillei Piper var. obtusatus C.L. Hitchc.","Coville's rush",,"Juncus","Monocot"
"JUDE","Juncus debilis A. Gray","weak rush",,"Juncus","Monocot"
"JUDI","Juncus dichotomus Elliott","forked rush",,"Juncus","Monocot"
"JUDRS","Juncus drummondii E. Mey. var. subtriflorus (E. Mey.) C.L. Hitchc.","threeflower rush",,"Juncus","Monocot"
"JUEFE","Juncus effusus L. var. exiguus Fernald & Wiegand","lamp rush",,"Juncus","Monocot"
"JUHY4","Jungermannia hyalina Lyell",,,"Jungermannia","Liverwort"
"JUKAH","Jungermannia karl-muelleri Grolle ssp. heteroicum (R.M. Schust.) Stotler & Stotl.-Crand.",,,"Jungermannia","Liverwort"
"JUMA4","Juncus marginatus Rostk.","grassleaf rush",,"Juncus","Monocot"
"JUMA8","Juglans mandshurica Maxim.","Manchurian walnut",,"Juglans","Dicot"
"JUMIS","Juglans microcarpa Berl. var. stewartii (I.M. Johnst.) W. Manning","Stewart's little walnut",,"Juglans","Dicot"
"JUOS","Juniperus osteosperma (Torr.) Little","Utah juniper",,"Juniperus","Gymnosperm"
"JUPA2","Juncus patens E. Mey.","spreading rush",,"Juncus","Monocot"
"JUPH2","Juniperus phoenicea L.","Phoenician juniper",,"Juniperus","Gymnosperm"
"JUPI5","Justicia pilosella (Nees) Hilsenb.","Gregg's tube tongue",,"Justicia","Dicot"
"JUSA","Juncus saximontanus A. Nelson","Rocky Mountain rush",,"Juncus","Monocot"
"JUSC4","Jungermannia schusterana J.D. Godfrey & G. Godfrey",,,"Jungermannia","Liverwort"
"JUST2","Juncus ×stuckeyi Reinking [alpinoarticulatus × torreyi]","rush",,"Juncus","Monocot"
"JUSU","Juncus subcaudatus (Engelm.) Coville & S.F. Blake","woodland rush",,"Juncus","Monocot"
"JUSU9","Julella sublactea (Nyl.) R.C. Harris","julella lichen",,"Julella","Lichen"
"JUTR3","Juncus triformis Engelm.","Yosemite dwarf rush",,"Juncus","Monocot"
"JUTR5","Juncus trigonocarpus Steud.","redpod rush",,"Juncus","Monocot"
"JUTW","Juncus tweedyi Rydb.","Tweedy's rush",,"Juncus","Monocot"
"JUVIV","Juniperus virginiana L. var. virginiana ","eastern redcedar",,"Juniperus","Gymnosperm"
"JUWR","Justicia wrightii A. Gray","Wright's waterwillow",,"Justicia","Dicot"
"KACA2","Kalmia carolina Small","Carolina laurel",,"Kalmia","Dicot"
"KAFE","Kalanchoe fedtschenkoi Raym.-Hamet & H. Perrier","lavender scallops",,"Kalanchoe","Dicot"
"KAGR","Kallstroemia grandiflora Torr. ex A. Gray","Arizona poppy",,"Kallstroemia","Dicot"
"KALAN","Kalanchoe Adans.","widow's-thrill",,"Kalanchoe","Dicot"
"KAMI","Kalmia microphylla (Hook.) A. Heller","alpine laurel",,"Kalmia","Dicot"
"KEANA","Keckiella antirrhinoides (Benth.) Straw ssp. antirrhinoides ","snapdragon penstemon",,"Keckiella","Dicot"
"KETEL","Keteleeria Carrière","keteleeria",,"Keteleeria","Gymnosperm"
"KIBL","Kiaeria blyttii (Schimp.) Broth.","Blytt's kiaeria moss",,"Kiaeria","Moss"
"KLAN","Kleinia anteuphorbium (L.) Haw.",,,"Kleinia","Dicot"
"KOBRE","Kobresia Willd.","bog sedge",,"Kobresia","Monocot"
"KOCA3","Koeleria caudata (Link) Steud.",,,"Koeleria","Monocot"
"KOELR","Koelreuteria Laxm.","koelreuteria",,"Koelreuteria","Dicot"
"KOENI","Koenigia L.","koenigia",,"Koenigia","Dicot"
"KOFL2","Kopsia flavida Blume","yellow kopsia",,"Kopsia","Dicot"
"KOHLE","Kohleria Regel","kohleria",,"Kohleria","Dicot"
"KOIS","Koenigia islandica L.","island purslane",,"Koenigia","Dicot"
"KOKIA","Kokia Lewt.","treecotton",,"Kokia","Dicot"
"KOMA","Koeleria macrantha (Ledeb.) Schult.","prairie Junegrass",,"Koeleria","Monocot"
"KOMY","Kobresia myosuroides (Vill.) Fiori","Bellardi bog sedge",,"Kobresia","Monocot"
"KOSI","Kobresia sibirica (Turcz. ex Ledeb.) Boeckeler","Siberian bog sedge",,"Kobresia","Monocot"
"KRER","Krameria erecta Willd. ex Schult.","littleleaf ratany",,"Krameria","Dicot"
"KRIX","Krameria ixine L.","abrojo colorado",,"Krameria","Dicot"
"KRRA","Krameria ramosissima (A. Gray) S. Watson","manystem ratany",,"Krameria","Dicot"
"KUSY","Kurzia sylvatica (A. Evans) Grolle",,,"Kurzia","Liverwort"
"KYBO","Kyhosia bolanderi (A. Gray) B.G. Baldw.","Bolander's madia",,"Kyhosia","Dicot"
"KYGR","Kyllinga gracillima Miq.","pasture spikesedge",,"Kyllinga","Monocot"
"KYHOS","Kyhosia B.G. Baldw.","kyhosia",,"Kyhosia","Dicot"
"LAAN81","Lavandula angustifolia Mill.","English lavender",,"Lavandula","Dicot"
"LAAS","Lavatera assurgentiflora Kellogg","island mallow",,"Lavatera","Dicot"
"LABI3","Lathyrus biflorus T.W. Nelson & J.P. Nelson","twoflower pea",,"Lathyrus","Dicot"
"LACA5","Lachnanthes caroliana (Lam.) Dandy","Carolina redroot",,"Lachnanthes","Monocot"
"LACA8","Lantana canescens Kunth","hammock shrubverbena",,"Lantana","Dicot"
"LACAC2","Lasthenia californica DC. ex Lindl. ssp. californica ","California goldfields",,"Lasthenia","Dicot"
"LACE","Lappula cenchrusoides A. Nelson","Great Plains stickseed",,"Lappula","Dicot"
"LACH","Layia chrysanthemoides (DC.) A. Gray","smooth tidytips",,"Layia","Dicot"
"LACL2","Lathyrus clymenum L.","cicercha purpurina",,"Lathyrus","Dicot"
"LACO14","Launaea cornuta (Hochst. ex Oliv. & Hiern) C. Jeffrey",,,"Launaea","Dicot"
"LACTU","Lactuca L.","lettuce",,"Lactuca","Dicot"
"LADE2","Larix decidua Mill.","European larch",,"Larix","Gymnosperm"
"LADI3","Lasiacis divaricata (L.) Hitchc.","smallcane",,"Lasiacis","Monocot"
"LAEN","Lachnocaulon engleri Ruhl.","Engler's bogbutton",,"Lachnocaulon","Monocot"
"LAEU","Lathyrus eucosmus Butters & H. St. John","bush vetchling",,"Lathyrus","Dicot"
"LAFA2","Labordia fagraeoidea Gaudich.","summit labordia",,"Labordia","Dicot"
"LAFR4","Lasthenia fremontii (Torr. ex A. Gray) Greene","Fremont's goldfields",,"Lasthenia","Dicot"
"LAGM3","Larix gmelinii (Rupr.) Rupr.","Dahurian larch",,"Larix","Gymnosperm"
"LAGR","Lactuca graminifolia Michx.","grassleaf lettuce",,"Lactuca","Dicot"
"LAHE2","Labordia hedyosmifolia Baill.","bog labordia",,"Labordia","Dicot"
"LAHE3","Labordia helleri Sherff","Napali Coast labordia",,"Labordia","Dicot"
"LAHE6","Landolphia heudelotii A. DC.","landolphia rubber",,"Landolphia","Dicot"
"LAHI5","Labordia hirtella H. Mann","mountain labordia",,"Labordia","Dicot"
"LAHO2","Lathyrus holochlorus (Piper) C.L. Hitchc.","thinleaf pea",,"Lathyrus","Dicot"
"LAIN14","Lathyrus inconspicuus L.","inconspicuous pea",,"Lathyrus","Dicot"
"LAJAM","Lathyrus japonicus Willd. var. maritimus (L.) Kartesz & Gandhi","beach pea",,"Lathyrus","Dicot"
"LALE4","Lasthenia leptalea (A. Gray) Ornduff","Salinas Valley goldfields",,"Lasthenia","Dicot"
"LALU","Lactuca ludoviciana (Nutt.) Riddell","biannual lettuce",,"Lactuca","Dicot"
"LAMA8","Lasthenia maritima (A. Gray) Ornduff","seaside goldfields",,"Lasthenia","Dicot"
"LAMO2","Lantana montevidensis (Spreng.) Briq.","trailing shrubverbena",,"Lantana","Dicot"
"LANEP5","Lathyrus nevadensis S. Watson ssp. lanceolatus (Howell) C.L. Hitchc. var. pilosellus (M. Peck) C.L. Hitchc.","Sierra pea",,"Lathyrus","Dicot"
"LANTA","Lantana L.","lantana",,"Lantana","Dicot"
"LAOC","Larix occidentalis Nutt.","western larch",,"Larix","Gymnosperm"
"LAPA4","Lathyrus palustris L.","marsh pea",,"Lathyrus","Dicot"
"LAPE3","Lallemantia peltata (L.) Fisch. & C.A. Mey.","lion's heart",,"Lallemantia","Dicot"
"LAPO2","Lathyrus polymorphus Nutt.","manystem pea",,"Lathyrus","Dicot"
"LAPU12","Landoltia punctata (G. Mey.) D.H. Les & D.J. Crawford","dotted duckmeat",,"Landoltia","Monocot"
"LAPUI","Lamium purpureum L. var. incisum (Willd.) Pers.","purple deadnettle",,"Lamium","Dicot"
"LASC3","Laennecia schiedeana (Less.) G.L. Nesom","pineland horseweed",,"Laennecia","Dicot"
"LASEP","Langloisia setosissima (Torr. & A. Gray ex Torr.) Greene ssp. punctata (A. Gray ex Coville) Timbrook","Great Basin langloisia",,"Langloisia","Dicot"
"LASI","Lagenaria siceraria (Molina) Standl.","bottle gourd",,"Lagenaria","Dicot"
"LASIO","Lasiospermum M. Lagasca","cocoonhead",,"Lasiospermum","Dicot"
"LASO2","Laennecia sophiifolia (Kunth) G.L. Nesom","leafy horseweed",,"Laennecia","Dicot"
"LASOP","Lasiacis sorghoidea (Desv. ex Ham.) Hitchc. & Chase var. patentiflora (Hitchc. & Chase) Davidse","woodland tribisee",,"Lasiacis","Monocot"
"LASP","Lagerstroemia speciosa (L.) Pers.","pride of India",,"Lagerstroemia","Dicot"
"LATA","Lactuca tatarica (L.) C.A. Mey.","blue lettuce",,"Lactuca","Dicot"
"LATE6","Lathrocasis tenerrima (A. Gray) L.A. Johnson","delicate gilia",,"Lathrocasis","Dicot"
"LATIW2","Labordia tinifolia A. Gray var. wahiawaensis H. St. John","Wahiawa labordia",,"Labordia","Dicot"
"LATO","Lathyrus torreyi A. Gray","Torrey's pea",,"Lathyrus","Dicot"
"LAUDE","Lauderlindsaya J.C. David & D. Hawksw.",,,"Lauderlindsaya","Lichen"
"LAUR2","Lantana urticoides Hayek","West Indian shrubverbena",,"Lantana","Dicot"
"LAVE","Lathyrus venosus Muhl. ex Willd.","veiny pea",,"Lathyrus","Dicot"
"LAVEA","Lathyrus vestitus Nutt. ssp. alefeldii (T.G. White) Broich","Alefeld's pea",,"Lathyrus","Dicot"
"LAVEL","Lathyrus vestitus Nutt. ssp. laetiflorus (Greene) Broich","Pacific pea",,"Lathyrus","Dicot"
"LAWA3","Labordia waiolani Wawra","Nevada peavine",,"Labordia","Dicot"
"LEAC8","Leucolepis acanthoneuron (Schwägr.) Lindb.","leucolepis umbrella moss",,"Leucolepis","Moss"
"LEAE2","Lemna aequinoctialis Welw.","lesser duckweed",,"Lemna","Monocot"
"LEALA","Leavenworthia alabamica Rollins var. alabamica ","Alabama gladecress",,"Leavenworthia","Dicot"
"LEALA2","Lecanora albella (Pers.) Ach. var. albella ",,,"Lecanora","Lichen"
"LEALE","Lepidium alyssoides A. Gray var. eastwoodiae (Wooton) Rollins","mesa pepperwort",,"Lepidium","Dicot"
"LEALR","Lecanora albella (Pers.) Ach. var. rubescens (Imshaug & Brodo) Lumbsch",,,"Lecanora","Lichen"
"LEAM13","Leptosiphon ambiguus (Rattan) J.M. Porter & L.A. Johnson","serpentine linanthus",,"Leptosiphon","Dicot"
"LEAN","Lespedeza angustifolia (Pursh) Elliott","narrowleaf lespedeza",,"Lespedeza","Dicot"
"LEAR15","Leptogium arcticum P.M. Jørg.","arctic skin lichen",,"Leptogium","Lichen"
"LEAR2","Lesquerella arctica (Wormsk. ex Hornem.) S. Watson","arctic bladderpod",,"Lesquerella","Dicot"
"LEAT61","Lecanora atrosulphurea (Wahlenb.) Ach.","rim lichen",,"Lecanora","Lichen"
"LEAUA3","Leptosiphon aureus (Nutt.) J.M. Porter & L.A. Johnson ssp. aureus ","golden linanthus",,"Leptosiphon","Dicot"
"LEAUD","Leptosiphon aureus (Nutt.) J.M. Porter & L.A. Johnson ssp. decorus (A. Gray) J.M. Porter & L.A. Johnson","golden linanthus",,"Leptosiphon","Dicot"
"LEBU","Leiophyllum buxifolium (Bergius) Elliott","sandmyrtle",,"Leiophyllum","Dicot"
"LEBY","Leptogium byssinum (Hoffm.) Zwackh ex Nyl.","skin lichen",,"Leptogium","Lichen"
"LECA18","Lesquerella calderi G. Mulligan & A.E. Porsild","Calder's bladderpod",,"Lesquerella","Dicot"
"LECA34","Lecidea cascadensis H. Magn.","Cascade lecidea lichen",,"Lecidea","Lichen"
"LECA35","Lecidella carpathica Körb.","lecidella lichen",,"Lecidella","Lichen"
"LECA4","Lepechinia cardiophylla Epling","Santa Ana pitchersage",,"Lepechinia","Dicot"
"LECA56","Lepraria cacuminum (A. Massal.) Lohtander",,,"Lepraria","Lichen"
"LECA8","Lespedeza capitata Michx.","roundhead lespedeza",,"Lespedeza","Dicot"
"LECAC2","Leptodactylon californicum Hook. & Arn. ssp. californicum ","California prickly phlox",,"Leptodactylon","Dicot"
"LECL2","Lecanora cladonioides Lynge","rim lichen",,"Lecanora","Lichen"
"LECO37","Leptospermum coriaceum (F. Muell. ex Miq.) Cheel","green teatree",,"Leptospermum","Dicot"
"LECO38","Lecania constricta W.A. Weber",,,"Lecania","Lichen"
"LECO8","Ledum ×columbianum Piper (pro sp.) [glandulosum × groenlandicum]","Labrador tea",,"Ledum","Dicot"
"LECRE","Leavenworthia crassa Rollins var. elongata ","fleshyfruit gladecress",,"Leavenworthia","Dicot"
"LEDE11","Lecidea despecta Th. Fr.","lecidea lichen",,"Lecidea","Lichen"
"LEDI12","Lecidea diapensiae Th. Fr.","lecidea lichen",,"Lecidea","Lichen"
"LEDU5","Lecania dudleyi Herre","Dudley's lecania lichen",,"Lecania","Lichen"
"LEEF","Lecidella effugiens (Nilson) Knoph & Hertel","lecidella lichen",,"Lecidella","Lichen"
"LEEL14","Leptolejeunea elliptica (Lehm. & Lindenb.) Schiffn.",,,"Leptolejeunea","Liverwort"
"LEER5","Leptogium erectum Sierk","erect skin lichen",,"Leptogium","Lichen"
"LEEXL","Leavenworthia exigua Rollins var. laciniata ","Tennessee gladecress",,"Leavenworthia","Dicot"
"LEFL18","Leptodontium flexifolium (With.) Hampe","leptodontium moss",,"Leptodontium","Moss"
"LEFLG2","Leptosiphon floribundum (A. Gray) J.M. Porter & L.A. Johnson ssp. glaber (R. Patt.) J.M. Porter & L.A. Johnson","manyflower linanthus",,"Leptosiphon","Dicot"
"LEFU4","Lecanora fuscescens (Sommerf.) Nyl.","rim lichen",,"Lecanora","Lichen"
"LEGLG","Lessingia glandulifera A. Gray var. glandulifera ","valley lessingia",,"Lessingia","Dicot"
"LEGR","Ledum groenlandicum Oeder","bog Labrador tea",,"Ledum","Dicot"
"LEGR15","Leprocaulon gracilescens (Nyl.) Lamb & Ward","mealy lichen",,"Leprocaulon","Lichen"
"LEHA8","Lecidea hassei Zahlbr.","Hasse's lecidea lichen",,"Lecidea","Lichen"
"LEHIH","Leontodon hispidus L. ssp. hispidus ","bristly hawkbit",,"Leontodon","Dicot"
"LEHIH2","Lespedeza hirta (L.) Hornem. ssp. hirta ","hairy lespedeza",,"Lespedeza","Dicot"
"LEHO2","Lecanora horiza (Ach.) Lindasy","rim lichen",,"Lecanora","Lichen"
"LEHY2","Lepidium hyssopifolium Desv.","hyssopleaf pepperweed",,"Lepidium","Dicot"
"LEHY4","Lecanora hybocarpa (Tuck.) Brodo","rim lichen",,"Lecanora","Lichen"
"LEINL","Lechea intermedia Leggett ex Britton var. laurentiana Hodgdon","largepod pinweed",,"Lechea","Dicot"
"LEITN","Leitneria Chapm.","corkwood",,"Leitneria","Dicot"
"LEKEK","Lewisia kelloggii K. Brandegee ssp. kelloggii ","Kellogg's lewisia",,"Lewisia","Dicot"
"LEKI2","Leucopoa kingii (S. Watson) W.A. Weber","spike fescue",,"Leucopoa","Monocot"
"LELA10","Leucanthemum lacustre (Brot.) Samp.","Portuguese daisy",,"Leucanthemum","Dicot"
"LELA7","Leptocoryphium lanatum (Kunth) Nees","lanilla",,"Leptocoryphium","Monocot"
"LELEL","Lessingia lemmonii A. Gray var. lemmonii ","Lemmon's lessingia",,"Lessingia","Dicot"
"LELI5","Lecanora lividolutea Rasanen","rim lichen",,"Lecanora","Lichen"
"LELO","Lespedeza ×longifolia DC. (pro sp.) [capitata × hirta]","lespedeza",,"Lespedeza","Dicot"
"LELO4","Lecanora louisianae de Lesd.","Louisiana rim lichen",,"Lecanora","Lichen"
"LELY6","Leibnitzia lyrata (D. Don) G.L. Nesom","Seeman's sunbonnets",,"Leibnitzia","Dicot"
"LEMA10","Lecanora maxima Lynge","rim lichen",,"Lecanora","Lichen"
"LEMA21","Lespedeza maximowiczii C.K. Schneid.",,,"Lespedeza","Dicot"
"LEMAM","Lechea maritima Leggett ex Britton, Sterns & Poggenb. var. maritima ","beach pinweed",,"Lechea","Dicot"
"LEMAV","Lechea maritima Leggett ex Britton, Sterns & Poggenb. var. virginica Hodgdon","Virginia pinweed",,"Lechea","Dicot"
"LEME","Lepanthopsis melanantha (Rchb. f.) Ames","tiny orchid",,"Lepanthopsis","Monocot"
"LEMI3","Lemna minor L.","common duckweed",,"Lemna","Monocot"
"LEMIH","Lejeunea minutiloba A. Evans var. heterogyna R.M. Schust.",,,"Lejeunea","Liverwort"
"LEMO9","Lecanora monticola H. Magn.","rim lichen",,"Lecanora","Lichen"
"LEMOC6","Lepidium montanum Nutt. var. coloradense Rollins","mountain pepperweed",,"Lepidium","Dicot"
"LEMU14","Lepisorus mucronatus (Fée) Li Wang","narrowtip lepisorus",,"Lepisorus","Fern"
"LENE15","Leskeella nervosa (Brid.) Loeske","leskeella",,"Leskeella","Moss"
"LENU8","Leptosiphon nuttallii (A. Gray) J.M. Porter & L.A. Johnson","Nuttall's linanthus",,"Leptosiphon","Dicot"
"LENUN","Leptosiphon nuttallii (A. Gray) J.M. Porter & L.A. Johnson ssp. nuttallii ","Nuttall's linanthus",,"Leptosiphon","Dicot"
"LEOB14","Leptosiphon oblanceolatus (Brand) J.M. Porter & L.A. Johnson","Sierra Nevada linanthus",,"Leptosiphon","Dicot"
"LEOB3","Lespedeza ×oblongifolia (Britton) W. Stone [angustifolia × hirta]","lespedeza",,"Lespedeza","Dicot"
"LEOB5","Lempholemma oblique-peltatum (Eschw.) C.W. Dodge","oblique lempholemma lichen",,"Lempholemma","Lichen"
"LEOR8","Lecanora orosthea (Ach.) Ach.",,,"Lecanora","Lichen"
"LEOVA","Lesquerella ovalifolia Rydb. ex Britton ssp. alba (Goodman) Rollins & Shaw","roundleaf bladderpod",,"Lesquerella","Dicot"
"LEPA17","Lepidium papilliferum (L.F. Hend.) A. Nelson & J.F. Macbr.","Idaho pepperweed",,"Lepidium","Dicot"
"LEPAD","Ledum palustre L. ssp. decumbens (Aiton) Hultén","marsh Labrador tea",,"Ledum","Dicot"
"LEPE13","Lecidea peliaspis (Tuck.) Zahlbr.","lecidea lichen",,"Lecidea","Lichen"
"LEPI2","Lepidium pinnatisectum (O.E. Schulz) C.L. Hitchc.","tansy pepperweed",,"Lepidium","Dicot"
"LEPI6","Lecanora piniperda Körb.","rim lichen",,"Lecanora","Lichen"
"LEPIN","Lepinia Decne.",,,"Lepinia","Dicot"
"LEPL3","Lecidea planetica Tuck.","lecidea lichen",,"Lecidea","Lichen"
"LEPR11","Lecidea protabacina Nyl.","lecidea lichen",,"Lecidea","Lichen"
"LEPTO11","Leptobryum (Bruch & Schimp.) Wilson","leptobryum moss",,"Leptobryum","Moss"
"LEPTU","Lepturus R. Br.","thintail",,"Lepturus","Monocot"
"LERE","Lepturus repens (G. Forst.) R. Br.","Pacific Island thintail",,"Lepturus","Monocot"
"LERER","Lewisia rediviva Pursh var. rediviva ","bitter root",,"Lewisia","Dicot"
"LERO7","Leptosiphon rosaceus (Hook. f.) Battaglia","rose linanthus",,"Leptosiphon","Dicot"
